{
  "$id": "https://tokenpilot.dev/schemas/runtime-snapshot.schema.json",
  "$schema": "https://json-schema.org/draft/2020-12/schema",
  "type": "object",
  "properties": {
    "schema_version": {
      "$ref": "#/$defs/__schema0"
    },
    "application_id": {
      "$ref": "#/$defs/__schema1"
    },
    "version": {
      "$ref": "#/$defs/__schema2"
    },
    "etag": {
      "$ref": "#/$defs/__schema3"
    },
    "signature": {
      "$ref": "#/$defs/__schema3"
    },
    "expires_at": {
      "$ref": "#/$defs/__schema4"
    },
    "routing": {
      "$ref": "#/$defs/__schema5"
    },
    "aiu": {
      "$ref": "#/$defs/__schema25"
    },
    "access": {
      "$ref": "#/$defs/__schema26"
    },
    "dimensions": {
      "$ref": "#/$defs/__schema28"
    }
  },
  "required": [
    "schema_version",
    "application_id",
    "version",
    "etag",
    "signature",
    "expires_at",
    "routing",
    "aiu",
    "access",
    "dimensions"
  ],
  "additionalProperties": false,
  "title": "Runtime Snapshot",
  "description": "ETag-addressed runtime configuration used by trusted SDKs and connectors.",
  "$defs": {
    "__schema0": {
      "type": "string",
      "const": "2.0"
    },
    "__schema1": {
      "type": "string",
      "format": "uuid",
      "pattern": "^([0-9a-fA-F]{8}-[0-9a-fA-F]{4}-[1-8][0-9a-fA-F]{3}-[89abAB][0-9a-fA-F]{3}-[0-9a-fA-F]{12}|00000000-0000-0000-0000-000000000000|ffffffff-ffff-ffff-ffff-ffffffffffff)$"
    },
    "__schema2": {
      "type": "string",
      "pattern": "^[A-Za-z0-9][A-Za-z0-9._:@-]{0,255}$"
    },
    "__schema3": {
      "type": "string",
      "pattern": "^sha256:[0-9a-f]{64}$"
    },
    "__schema4": {
      "type": "string",
      "pattern": "^[0-9]{4}-[0-9]{2}-[0-9]{2}T[0-9]{2}:[0-9]{2}:[0-9]{2}(?:\\.[0-9]{1,9})?Z$"
    },
    "__schema5": {
      "type": "object",
      "propertyNames": {
        "type": "string",
        "maxLength": 120,
        "pattern": "^[a-z][a-z0-9]*(?:[._-][a-z0-9]+)*$"
      },
      "additionalProperties": {
        "type": "object",
        "properties": {
          "virtual_model_id": {
            "$ref": "#/$defs/__schema2"
          },
          "configuration_version": {
            "$ref": "#/$defs/__schema6"
          },
          "configuration_etag": {
            "$ref": "#/$defs/__schema3"
          },
          "published_at": {
            "$ref": "#/$defs/__schema4"
          },
          "timezone": {
            "$ref": "#/$defs/__schema7"
          },
          "default": {
            "$ref": "#/$defs/__schema8"
          },
          "rules": {
            "$ref": "#/$defs/__schema13"
          }
        },
        "required": [
          "virtual_model_id",
          "configuration_version",
          "configuration_etag",
          "published_at",
          "timezone",
          "default",
          "rules"
        ],
        "additionalProperties": false
      }
    },
    "__schema6": {
      "type": "integer",
      "exclusiveMinimum": 0,
      "maximum": 9007199254740991
    },
    "__schema7": {
      "type": "string",
      "minLength": 1,
      "maxLength": 128
    },
    "__schema8": {
      "type": "object",
      "properties": {
        "route_tag": {
          "$ref": "#/$defs/__schema9"
        },
        "selection_mode": {
          "$ref": "#/$defs/__schema10"
        },
        "targets": {
          "$ref": "#/$defs/__schema11"
        }
      },
      "required": [
        "route_tag",
        "selection_mode",
        "targets"
      ],
      "additionalProperties": false
    },
    "__schema9": {
      "type": "string",
      "maxLength": 200,
      "pattern": "^cp:[a-z0-9][a-z0-9._-]*(?::[a-z0-9][a-z0-9._-]*)+$"
    },
    "__schema10": {
      "type": "string",
      "enum": [
        "ordered",
        "weighted"
      ]
    },
    "__schema11": {
      "minItems": 1,
      "maxItems": 64,
      "type": "array",
      "items": {
        "$ref": "#/$defs/__schema12"
      }
    },
    "__schema12": {
      "type": "object",
      "properties": {
        "model_id": {
          "$ref": "#/$defs/__schema2"
        },
        "model_tag": {
          "type": "string",
          "minLength": 1,
          "maxLength": 256
        },
        "provider": {
          "type": "string",
          "minLength": 1,
          "maxLength": 120
        },
        "route_tag": {
          "$ref": "#/$defs/__schema9"
        },
        "fallback_order": {
          "type": "integer",
          "minimum": 0,
          "maximum": 63
        },
        "weight": {
          "anyOf": [
            {
              "type": "integer",
              "exclusiveMinimum": 0,
              "maximum": 1000
            },
            {
              "type": "number",
              "exclusiveMinimum": 0,
              "maximum": 1000
            }
          ]
        }
      },
      "required": [
        "model_id",
        "model_tag",
        "route_tag",
        "fallback_order",
        "weight"
      ],
      "additionalProperties": false
    },
    "__schema13": {
      "maxItems": 512,
      "type": "array",
      "items": {
        "$ref": "#/$defs/__schema14"
      }
    },
    "__schema14": {
      "type": "object",
      "properties": {
        "id": {
          "$ref": "#/$defs/__schema15"
        },
        "priority": {
          "$ref": "#/$defs/__schema16"
        },
        "match": {
          "$ref": "#/$defs/__schema17"
        },
        "route": {
          "$ref": "#/$defs/__schema8"
        },
        "expires_at": {
          "$ref": "#/$defs/__schema24"
        }
      },
      "required": [
        "id",
        "priority",
        "match",
        "route"
      ],
      "additionalProperties": false
    },
    "__schema15": {
      "type": "string",
      "minLength": 1,
      "maxLength": 120
    },
    "__schema16": {
      "type": "integer",
      "minimum": -9007199254740991,
      "maximum": 9007199254740991
    },
    "__schema17": {
      "anyOf": [
        {
          "type": "object",
          "properties": {
            "override_active": {
              "type": "boolean",
              "const": true
            }
          },
          "required": [
            "override_active"
          ],
          "additionalProperties": false
        },
        {
          "type": "object",
          "properties": {
            "schedule": {
              "type": "object",
              "properties": {
                "days": {
                  "minItems": 1,
                  "maxItems": 7,
                  "type": "array",
                  "items": {
                    "$ref": "#/$defs/__schema18"
                  }
                },
                "from": {
                  "$ref": "#/$defs/__schema19"
                },
                "to": {
                  "$ref": "#/$defs/__schema19"
                }
              },
              "required": [
                "days",
                "from",
                "to"
              ],
              "additionalProperties": false
            }
          },
          "required": [
            "schedule"
          ],
          "additionalProperties": false
        },
        {
          "type": "object",
          "properties": {
            "user": {
              "type": "object",
              "properties": {
                "ids": {
                  "maxItems": 50000,
                  "type": "array",
                  "items": {
                    "$ref": "#/$defs/__schema20"
                  }
                }
              },
              "required": [
                "ids"
              ],
              "additionalProperties": false
            }
          },
          "required": [
            "user"
          ],
          "additionalProperties": false
        },
        {
          "type": "object",
          "properties": {
            "user_property": {
              "type": "object",
              "properties": {
                "key": {
                  "$ref": "#/$defs/__schema21"
                },
                "operator": {
                  "$ref": "#/$defs/__schema22"
                },
                "value": {
                  "$ref": "#/$defs/__schema23"
                }
              },
              "required": [
                "key",
                "operator"
              ],
              "additionalProperties": false
            }
          },
          "required": [
            "user_property"
          ],
          "additionalProperties": false
        },
        {
          "type": "object",
          "properties": {
            "call_source": {
              "type": "object",
              "properties": {
                "value": {
                  "type": "string",
                  "minLength": 1,
                  "maxLength": 120
                }
              },
              "required": [
                "value"
              ],
              "additionalProperties": false
            }
          },
          "required": [
            "call_source"
          ],
          "additionalProperties": false
        }
      ]
    },
    "__schema18": {
      "type": "integer",
      "minimum": 1,
      "maximum": 7
    },
    "__schema19": {
      "type": "string",
      "pattern": "^(?:[01]\\d|2[0-3]):[0-5]\\d$"
    },
    "__schema20": {
      "type": "string",
      "minLength": 1,
      "maxLength": 256
    },
    "__schema21": {
      "type": "string",
      "pattern": "^[a-z][a-z0-9._-]{0,127}$"
    },
    "__schema22": {
      "type": "string",
      "enum": [
        "equals",
        "not_equals",
        "contains",
        "starts_with",
        "is_set",
        "is_not_set"
      ]
    },
    "__schema23": {
      "anyOf": [
        {
          "type": "string",
          "maxLength": 2048
        },
        {
          "type": "integer",
          "minimum": -9007199254740991,
          "maximum": 9007199254740991
        },
        {
          "type": "boolean"
        }
      ]
    },
    "__schema24": {
      "$ref": "#/$defs/__schema4"
    },
    "__schema25": {
      "type": "object",
      "properties": {
        "enabled": {
          "type": "boolean"
        },
        "mode": {
          "$ref": "#/$defs/AiuMode"
        },
        "unrated_model_policy": {
          "type": "string",
          "enum": [
            "allow_unrated",
            "block_unrated",
            "fallback_required",
            "alert_only"
          ]
        }
      },
      "required": [
        "enabled",
        "mode",
        "unrated_model_policy"
      ],
      "additionalProperties": false
    },
    "AiuMode": {
      "type": "string",
      "enum": [
        "disabled",
        "observe",
        "soft_limit",
        "hard_limit",
        "unknown"
      ]
    },
    "__schema26": {
      "type": "object",
      "properties": {
        "application_enabled": {
          "type": "boolean"
        },
        "blocked_user_ids": {
          "maxItems": 50000,
          "type": "array",
          "items": {
            "$ref": "#/$defs/__schema27"
          }
        }
      },
      "required": [
        "application_enabled",
        "blocked_user_ids"
      ],
      "additionalProperties": false
    },
    "__schema27": {
      "type": "string",
      "minLength": 1,
      "maxLength": 256
    },
    "__schema28": {
      "type": "object",
      "properties": {
        "analytics_allowed_keys": {
          "maxItems": 256,
          "type": "array",
          "items": {
            "$ref": "#/$defs/__schema29"
          }
        }
      },
      "required": [
        "analytics_allowed_keys"
      ],
      "additionalProperties": false
    },
    "__schema29": {
      "type": "string",
      "pattern": "^[a-z][a-z0-9_]{0,63}$"
    }
  }
}
